{
  "$comment": "실과 5학년 교과서 등록부. contracts/textbook.schema.json 을 따른다.",
  "$status": "5단원 1소단원만 채워져 있다. **소단원 학습목표는 교과서 76쪽 원문으로 대조 완료(verified: true).** 차시는 골든 픽스처가 있는 4차시 하나뿐이며, 그 목표는 교과서가 아니라 담임의 단원 마스터 프롬프트에서 온 것이라 verified: false 다. 6·7단원 교과서·지도서 PDF 도 드라이브에 있으므로 이어서 채울 수 있다.",
  "$source_files": "구글드라이브 2학기/교과서/실과/실과5_교과서_쪽수별/NNN쪽.pdf · 미래엔_실과5_교과서_5_건설과디지털기술.pdf",

  "subject": "실과",
  "grade": 5,
  "semester": 2,
  "publisher": "미래엔",
  "curriculum": "2022 개정",

  "units": [
    {
      "unit": "5. 건설과 디지털 기술",
      "sub_unit": "1. 건설 기술과 친환경 건설 구조물",
      "objectives": [
        {
          "text": "친환경 건설 구조물을 탐색하고 친환경 건설 구조물 모형을 만들어 보며 건설 기술의 가치를 알 수 있습니다.",
          "verified": true,
          "source": "교과서 76쪽 「학습 목표」"
        }
      ],
      "standards": ["6실04-01"],
      "lessons": [
        {
          "period": "4/12",
          "title": "친환경 건설 구조물 모형 만들기 — 아이디어 스케치",
          "pages": [77, 77],
          "objective": "친환경 요소를 넣은 구조물 모형을 구상하고 크기와 재료가 드러나도록 스케치할 수 있다.",
          "verified": false,
          "source": "실과 5단원 마스터 프롬프트 md · 쪽수는 교과서 쪽수별 PDF 로 확인",
          "note": "교과서 77쪽 「해 보기 — 친환경 건설 구조물 모형 만들기(모둠)」 의 ①아이디어 구상하기 ②아이디어 스케치하기 에 해당한다. 교과서가 '모형의 크기를 알 수 있게 가로, 세로, 높이 등을 숫자로 표시합니다. 단위는 밀리미터이며, 표시는 생략합니다' 라고 지시하는데, 골든 픽스처의 오개념 지도('치수 표시 없음')가 여기서 나온 것이다. 76쪽은 친환경 건설 구조물 사례(태양 전지·풍력 발전기·재활용 재료·옥상 정원)."
        }
      ]
    }
  ]
}
