{
  "$comment": "사회 5-2 교과서 차시 등록부. contracts/textbook.schema.json 을 따른다. 담임이 계속 보충한다(2026-07-29).",
  "$status": "2-1 소단원만 채워져 있다. **소단원 학습목표 2개는 교과서 76쪽 원문으로 대조 완료(verified: true).** 차시별 목표는 교과서가 주지 않는 것이라 선생님 학습지에서 옮긴 것이며 verified: false 다. 교과서 쪽수는 쪽수별 PDF 로 확인했다. 나머지 6개 소단원 41차시는 미등록.",
  "subject": "사회",
  "grade": 5,
  "semester": 2,
  "publisher": "아이스크림미디어 (한춘희 외 18인) · ISBN 979-11-5929-453-2",
  "curriculum": "2022 개정",
  "units": [
    {
      "unit": "2. 달라지는 시대, 변화하는 생활 모습",
      "sub_unit": "2-1 유교 문화의 영향으로 달라진 조선 사회",
      "objectives": [
        {
          "text": "유교 문화가 조선 시대 사람들의 생각에 미친 영향을 알 수 있습니다.",
          "verified": true,
          "source": "교과서 76쪽 「이 주제를 공부하면」 1"
        },
        {
          "text": "유교 문화에 따른 조선 시대 사람들의 달라진 생활 모습을 알 수 있습니다.",
          "verified": true,
          "source": "교과서 76쪽 「이 주제를 공부하면」 2"
        }
      ],
      "standards": [
        "6사05-01"
      ],
      "lessons": [
        {
          "period": "1/14",
          "title": "단원 열기 — 유교 문화 축제에 초대합니다",
          "pages": [
            70,
            75
          ],
          "objective": "유교 문화가 조선 사람들의 생활에 영향을 주었음을 알고 탐구 질문을 만들 수 있다.",
          "verified": false,
          "source": "사회/활동지/2단원_2-1_유교조선_학습지.pdf 1쪽 · 쪽수는 교과서 쪽수별 PDF 로 확인",
          "note": "교과서 70~75쪽은 **단원 열기**라 차시 학습목표가 인쇄돼 있지 않다. 여기 적힌 목표는 선생님 학습지의 것이다. 70 단원 표지 · 71~72 사라진 동생 태웅이 찾기(가족의 말 4개 + 실마리 ①②③) · 73~74 '조선은 유교를 바탕으로 세워진 나라란다' · 75 중요 단어와 탐구 질문 만들기(예시: '유교 문화가 조선 사회에 미친 영향은 무엇일까요?'). ★ 교과서 실마리 ③ 은 '가족의 이야기와 일치하는 **사람**을 찾아보세요' 인데, 세안은 '어느 **체험관**에 있을지'로 적었다. 교과서는 그림 속 인물 찾기까지 가고 세안은 장소 추측에서 멈춘다 — 담임 확인 필요."
        },
        {
          "period": "2/14",
          "title": "유교를 바탕으로 건국한 조선 ① 한양",
          "pages": [
            76,
            79
          ],
          "objective": "한양의 건축물 이름에 담긴 유교 정신으로 조선이 유교의 나라임을 파악한다.",
          "verified": false,
          "source": "사회/활동지/2단원_2-1_유교조선_학습지.pdf 2쪽 · 쪽수는 교과서 쪽수별 PDF 로 확인",
          "note": "교과서 76쪽이 소단원 2-1 의 시작이다(「이 주제를 공부하면」 + 김득신 「노상알현도」 생각 열기). 77쪽 「유교를 바탕으로 건국한 조선을 알아볼까요」 에 한양 건축물 붙임딱지 활동이 있고 '인·의·예' 찾기까지 지시돼 있다 (활동 자료 5 · 지도서 167쪽). 약안이 '새로 필요: 2차시 건축물 붙임딱지' 라고 적어 두었으나 **교과서 부록에 이미 있다.** 79쪽은 유교 정신(충·효·질서·믿음)과 오늘날 유교 정신 찾기."
        },
        {
          "period": "3/14",
          "title": "유교를 바탕으로 건국한 조선 ② 유교 정신·서당",
          "pages": [
            80,
            81
          ],
          "objective": "서당과 유교의 기본 정신으로 유교가 생활에 준 영향을 파악한다.",
          "verified": false,
          "source": "사회/활동지/2단원_2-1_유교조선_학습지.pdf 3쪽 · 쪽수는 교과서 쪽수별 PDF 로 확인"
        },
        {
          "period": "4/14",
          "title": "유교 질서에 따른 조선 사회 ① 신분과 생활",
          "pages": [
            82,
            84
          ],
          "objective": "신분에 따라 하는 일과 생활이 달랐음을 자료로 파악한다.",
          "verified": false,
          "source": "사회/활동지/2단원_2-1_유교조선_학습지.pdf 4쪽 · 쪽수는 교과서 쪽수별 PDF 로 확인"
        },
        {
          "period": "5/14",
          "title": "유교 질서에 따른 조선 사회 ② 가상 일기",
          "pages": [
            85,
            86
          ],
          "objective": "조선 시대 인물이 되어 신분·성별에 따른 생활을 일기로 표현할 수 있다.",
          "verified": false,
          "source": "사회/활동지/2단원_2-1_유교조선_학습지.pdf 5쪽 · 쪽수는 교과서 쪽수별 PDF 로 확인",
          "note": "과정중심평가 차시. 약안에 루브릭 3수준이 있다."
        },
        {
          "period": "6/14",
          "title": "조선의 발전 — 세종과 훈민정음",
          "pages": [
            87,
            89
          ],
          "objective": "세종 대 과학·문화의 발전이 백성 생활에 준 영향을 파악한다.",
          "verified": false,
          "source": "사회/활동지/2단원_2-1_유교조선_학습지.pdf 6쪽 · 쪽수는 교과서 쪽수별 PDF 로 확인"
        },
        {
          "period": "7/14",
          "title": "조선과 주변 나라 — 임진왜란·병자호란",
          "pages": [
            90,
            93
          ],
          "objective": "두 전쟁의 전개·극복 노력을 파악하고 백성 생활의 변화를 추론한다.",
          "verified": false,
          "source": "사회/활동지/2단원_2-1_유교조선_학습지.pdf 7쪽 · 쪽수는 교과서 쪽수별 PDF 로 확인"
        }
      ]
    }
  ],
  "$source_files": "구글드라이브 2학기/교과서/사회_5-2_교과서_단원별/사회_5-2_교과서_쪽수별/NNN쪽.pdf"
}
